URL,Version,Status,OIDs,Name,Title,Description,Used
http://fdasis.nlm.nih.gov,1.0.0,active,"2.16.840.1.113883.4.9",UNII,Unique Ingredient Identifier (UNII),"A UNII is a non-proprietary, free, unique, unambiguous, nonsemantic, alphanumeric identifier based on a substance's molecular structure and/or descriptive information. UNII identifiers are generated based on scientific identity characteristics using ISO 11238 data elements. UNII availability does not imply any regulatory review or approval. Synonyms and mappings are based on the best public information available at the time of publication.","ValueSet/mii-vs-onko-systemische-therapie-substanzen-unii"
http://fhir.de/CodeSystem/ask,null,active,,Ask,Arzneimittel-Stoffkatalog,"Arzneimittel-Stoffkatalog (ASK) Platzhalter-CodeSystem","ConceptMap/CM-Senologie-Medikation-SCT-ASK"
http://fhir.de/CodeSystem/bfarm/alpha-id,null,active,,AlphaId,Alpha-ID,"Alpha-ID Platzhalter-CodeSystem","ValueSet/mii-vs-diagnose-alphaid"
http://fhir.de/CodeSystem/bfarm/atc,null,active,,Atc,ATC,"ATC Platzhalter-CodeSystem","ConceptMap/cm-oncobox-endokrine-substanz-atc,ConceptMap/CM-Senologie-Medikation-SCT-ATC,ValueSet/mii-vs-medikation-atc"
http://fhir.de/CodeSystem/bfarm/icd-10-gm,null,active,,ICD10GM,ICD-10-GM,"ICD-10-GM Platzhalter-CodeSystem","ValueSet/mii-vs-diagnose-icd10gm,ValueSet/vs-senologie-icd10,ValueSet/valueset-ICD-10-GM"
http://fhir.de/CodeSystem/bfarm/ops,null,active,,OPS,OPS,"OPS Platzhalter-CodeSystem","ValueSet/mii-vs-onko-mamma-operation-ops,ValueSet/mii-vs-onko-ops-strahlentherapie,ValueSet/mii-vs-prozedur-ops"
http://hl7.org/fhir/CodeSystem/medication-statement-status,5.0.0,active,,MedicationStatementStatusCodes,MedicationStatement Status Codes,"MedicationStatement Status Codes","ValueSet/medication-statement-status"
http://hl7.org/fhir/CodeSystem/medicationrequest-intent,5.0.0,active,,MedicationRequestIntentCodes,MedicationRequest Intent Codes,"MedicationRequest Intent Codes","ValueSet/medicationrequest-intent"
http://hl7.org/fhir/CodeSystem/medicationrequest-status,5.0.0,active,,MedicationRequestStatusCodes,MedicationRequest Status Codes,"MedicationRequest Status Codes","ValueSet/medicationrequest-status"
http://hl7.org/fhir/administrative-gender,5.0.0,active,,AdministrativeGender,AdministrativeGender,"The gender of a person used for administrative purposes.","ValueSet/administrative-gender"
http://hl7.org/fhir/adverse-event-actuality,5.0.0,active,,AdverseEventActuality,Adverse Event Actuality,"Overall nature of the adverse event, e.g. real or potential.","ValueSet/adverse-event-actuality"
http://hl7.org/fhir/care-plan-activity-status,4.0.1,draft,"2.16.840.1.113883.4.642.4.147",CarePlanActivityStatus,CarePlanActivityStatus,"Codes that reflect the current state of a care plan activity within its overall life cycle.","ValueSet/care-plan-activity-status"
http://hl7.org/fhir/days-of-week,5.0.0,active,,DaysOfWeek,Days Of Week,"The days of the week.","ValueSet/days-of-week"
http://hl7.org/fhir/device-nametype,5.0.0,active,,DeviceNameType,Device Name Type,"The type of name the device is referred by.","ValueSet/device-nametype"
http://hl7.org/fhir/device-status,5.0.0,active,,FHIRDeviceStatus,FHIR Device Status,"The status of the Device record.","ValueSet/device-status"
http://hl7.org/fhir/diagnostic-report-status,5.0.0,active,,DiagnosticReportStatus,Diagnostic Report Status,"The status of the diagnostic report.","ValueSet/diagnostic-report-status"
http://hl7.org/fhir/event-status,5.0.0,draft,,EventStatus,EventStatus,"Codes identifying the lifecycle stage of an event.","ValueSet/event-status"
http://hl7.org/fhir/event-timing,5.0.0,active,,EventTiming,EventTiming,"Real-world event relating to the schedule.","ValueSet/event-timing"
http://hl7.org/fhir/history-status,5.0.0,active,,FamilyHistoryStatus,Family History Status,"A code that identifies the status of the family history record.","ValueSet/history-status"
http://hl7.org/fhir/identifier-use,5.0.0,active,,IdentifierUse,IdentifierUse,"Identifies the purpose for this identifier, if known .","ValueSet/identifier-use"
http://hl7.org/fhir/observation-status,5.0.0,active,,ObservationStatus,Observation Status,"Codes providing the status of an observation.","ValueSet/observation-status"
http://hl7.org/fhir/quantity-comparator,5.0.0,active,,QuantityComparator,QuantityComparator,"How the Quantity should be understood and represented.","ValueSet/quantity-comparator"
http://hl7.org/fhir/request-intent,5.0.0,draft,,RequestIntent,RequestIntent,"Codes indicating the degree of authority/intentionality associated with a request.","ValueSet/request-intent,ValueSet/care-plan-intent"
http://hl7.org/fhir/request-priority,5.0.0,draft,,RequestPriority,RequestPriority,"Identifies the level of importance to be assigned to actioning the request.","ValueSet/request-priority"
http://hl7.org/fhir/request-status,5.0.0,draft,,RequestStatus,RequestStatus,"Codes identifying the lifecycle stage of a request.","ValueSet/request-status"
http://hl7.org/fhir/research-subject-status,4.0.1,draft,"2.16.840.1.113883.4.642.4.830",ResearchSubjectStatus,ResearchSubjectStatus,"Indicates the progression of a study subject through a study.","ValueSet/research-subject-status"
http://hl7.org/fhir/resource-types,4.0.1,active,,ResourceType,ResourceType,"One of the resource types defined as part of this version of FHIR.","ValueSet/resource-types,ValueSet/care-plan-activity-kind"
http://hl7.org/fhir/specimen-status,5.0.0,active,,SpecimenStatus,Specimen Status,"Codes providing the status/availability of a specimen.","ValueSet/specimen-status"
http://hl7.org/fhir/udi-entry-type,5.0.0,active,,UDIEntryType,UDI Entry Type,"Codes to identify how UDI data was entered.","ValueSet/udi-entry-type"
http://hl7.org/fhir/uv/genomics-reporting/CodeSystem/molecular-biomarker-ontology-cs,3.0.0,active,,MolecularBiomarkerOntologyCS,Molecular Biomarker Ontology Codes,"This (experimental) code system provides for a draft categorization of biomarkers along several axes. Based on ballot feedback, the committee anticipates significant revisions.","ValueSet/molecular-biomarker-category-vs"
http://ihe-d.de/CodeSystems/FallkontextBeiDokumentenerstellung,2021-07-06T21:19:41,active,,FallkontextBeiDokumentenerstellung,Fallkontext Bei Dokumentenerstellung,"","ValueSet/mii-vs-medikation-fallkontext"
http://loinc.org,3.1.0,active,"2.16.840.1.113883.6.1",LOINC,Logical Observation Identifiers, Names and Codes (LOINC),"LOINC provides a set of universal names and ID codes for identifying laboratory and clinical test results.1,2 LOINC facilitates the exchange and pooling of results, such as blood hemoglobin, serum potassium, or vital signs, for clinical care, outcomes management, and research. LOINC's universal identifiers (names and codes) can be used in the context of order and observation exchanges between information systems that use syntax standards such as HL73, CEN TC251, ISO TC215, ASTM4, and DICOM. Specifically, the identifier can be used as the coded value for an observation in any other standard that uses the observation/observation value paradigm, whether messages, documents, application programming interface (API), etc. For example, LOINC codes are used widely in the OBX segment Observation Identifier field (OBX-3) of an ORU HL7 (HL7 version 2.x or ASTM 1238-9410) message that may be sent between a Clinical Laboratory Information Management Systems (LIMS) and Electronic Health Record Systems (EHR).5, 6 In this way, LOINC codes provide universal identifiers that allow the exchange of clinical data between heterogeneous computing environments.","ValueSet/report-codes,ValueSet/null,ValueSet/observation-codes"
http://snomed.info/sct,null,active,"2.16.840.1.113883.6.96",SNOMED_CT,SNOMED CT (all versions),"SNOMED CT is the most comprehensive and precise clinical health terminology product in the world, owned and distributed around the world by The International Health Terminology Standards Development Organisation (IHTSDO).","ConceptMap/cm-sct-to-obds-intention,ValueSet/servicerequest-category,ConceptMap/CM-Senologie-Medikation-SCT-ASK,ValueSet/device-type,ValueSet/ips-target-site-uv-ips,ValueSet/mii-vs-diagnose-bodystructure-snomed,ValueSet/vs-senologie-diagnose-lokal,ValueSet/procedure-followup,ValueSet/mii-vs-onko-mamma-operation-sct,ConceptMap/cm-sct-to-obds-seitenlokalisation,ValueSet/mii-vs-onko-mamma-intraoperatives-imaging-praeparat,ValueSet/mii-vs-patho-processing-procedure-snomed-ct,ConceptMap/cm-sct-to-obds-verlauf-gesamtbeurteilung,ValueSet/adverse-event-type,ValueSet/body-site,ValueSet/manifestation-or-symptom,ValueSet/procedure-code,ValueSet/bodystructure-code,ValueSet/medication-as-needed-reason,ValueSet/reason-medication-status-codes,ValueSet/mii-vs-biobank-probenart-sct,ValueSet/mii-vs-patho-collection-method-snomed-ct,ValueSet/vs-senologie-diagnose,ValueSet/observation-methods,ValueSet/care-plan-category,ValueSet/vs-senologie-diagnose-sct,ConceptMap/CM-Senologie-Medikation-SCT-ATC,ValueSet/servicerequest-orderdetail,ConceptMap/cm-sct-to-obds-grading,ValueSet/vs-senologie-diagnose-b3,ValueSet/condition-stage,ValueSet/clinical-findings,ValueSet/vs-senologie-systemtherapie-medikation,ConceptMap/cm-sct-to-icdo3-mamma-topographie,ValueSet/additional-instruction-codes,ValueSet/participant-role,ValueSet/lebensphase-de,ValueSet/approach-site-codes,ValueSet/condition-predecessor,ValueSet/mii-vs-prozedur-prozeduren-snomedct,ValueSet/mii-vs-prozedur-opskategorien-snomedct,ValueSet/device-action,ValueSet/medication-codes,ConceptMap/cm-sct-to-obds-residualstatus,ValueSet/vs-senologie-screeningstatus,ValueSet/vs-senologie-zweittumor,ValueSet/device-kind,ValueSet/performer-role,ValueSet/mii-vs-onko-mamma-praeoperative-markierung-modalitaet,ValueSet/referencerange-appliesto,ValueSet/route-codes,ValueSet/mii-vs-patho-container-type-snomed-ct,ValueSet/care-plan-activity-outcome,ValueSet/procedure-reason,ValueSet/procedure-outcome,ValueSet/procedure-category,ValueSet/mii-vs-biobank-body-structures-sct,ValueSet/condition-code,ValueSet/condition-stage-type,ConceptMap/cm-sct-to-obds-therapieart,ConceptMap/cm-sct-to-obds-therapiestellung,ValueSet/null,ValueSet/procedure-not-performed-reason,ValueSet/condition-outcome,ValueSet/administration-method-codes,ValueSet/vs-senologie-operation-art,ConceptMap/cm-sct-to-obds-fm-lokalisation,ValueSet/mii-vs-biobank-laboratory-procedure-sct,ValueSet/condition-severity"
http://terminology.hl7.org/CodeSystem/adverse-event-category,2.0.0,active,"2.16.840.1.113883.4.642.1.1251",AdverseEventCategory,AdverseEventCategory,"Overall categorization of the event, e.g. product-related or situational.","ValueSet/adverse-event-category"
http://terminology.hl7.org/CodeSystem/adverse-event-causality-assess,1.0.1,active,"2.16.840.1.113883.4.642.1.1254",AdverseEventCausalityAssessment,AdverseEventCausalityAssessment,"Codes for the assessment of whether the entity caused the event.","ValueSet/adverse-event-causality-assess"
http://terminology.hl7.org/CodeSystem/adverse-event-causality-method,2.0.0,active,"2.16.840.1.113883.4.642.1.1255",AdverseEventCausalityMethod,AdverseEventCausalityMethod,"This code system contains methods for assessing causality.","ValueSet/adverse-event-causality-method"
http://terminology.hl7.org/CodeSystem/adverse-event-outcome,4.0.1,draft,"2.16.840.1.113883.4.642.4.1252",AdverseEventOutcome,AdverseEventOutcome,"TODO (and should this be required?).","ValueSet/adverse-event-outcome"
http://terminology.hl7.org/CodeSystem/adverse-event-severity,2.0.0,active,"2.16.840.1.113883.4.642.1.1256",AdverseEventSeverity,AdverseEventSeverity,"The severity of the adverse event itself, in direct relation to the subject.","ValueSet/adverse-event-severity"
http://terminology.hl7.org/CodeSystem/common-tags,1.0.1,active,"2.16.840.1.113883.4.642.1.1067",CommonTags,Common Tags,"Common Tag Codes defined by FHIR project","ValueSet/common-tags"
http://terminology.hl7.org/CodeSystem/condition-category,2.0.0,active,"2.16.840.1.113883.4.642.1.1073",ConditionCategoryCodes,Condition Category Codes,"Preferred value set for Condition Categories.","ValueSet/condition-category"
http://terminology.hl7.org/CodeSystem/condition-clinical,3.0.0,active,"2.16.840.1.113883.4.642.1.1074",ConditionClinicalStatusCodes,Condition Clinical Status Codes,"Preferred value set for Condition Clinical Status.","ValueSet/condition-clinical"
http://terminology.hl7.org/CodeSystem/condition-ver-status,2.0.1,active,"2.16.840.1.113883.4.642.1.1075",ConditionVerificationStatus,ConditionVerificationStatus,"The verification status to support or decline the clinical status of the condition or diagnosis.","ValueSet/condition-ver-status"
http://terminology.hl7.org/CodeSystem/data-absent-reason,1.0.0,active,"2.16.840.1.113883.4.642.4.1048",DataAbsentReason,DataAbsentReason,"Used to specify why the normally expected content of the data element is missing.","ValueSet/data-absent-reason"
http://terminology.hl7.org/CodeSystem/device-status-reason,2.0.0,active,"2.16.840.1.113883.4.642.1.1082",FHIRDeviceStatusReason,FHIRDeviceStatusReason,"The availability status reason of the device.","ValueSet/device-status-reason"
http://terminology.hl7.org/CodeSystem/dose-rate-type,2.0.0,active,"2.16.840.1.113883.4.642.1.1069",DoseAndRateType,DoseAndRateType,"The kind of dose or rate specified.","ValueSet/dose-rate-type"
http://terminology.hl7.org/CodeSystem/history-absent-reason,1.0.1,active,"2.16.840.1.113883.4.642.1.1094",FamilyHistoryAbsentReason,FamilyHistoryAbsentReason,"Codes describing the reason why a family member's history is not available.","ValueSet/history-absent-reason"
http://terminology.hl7.org/CodeSystem/icd-o-3,2.0.1,active,"2.16.840.1.113883.6.43.1",IcdO3,International Classification of Diseases for Oncology, version 3.,"International Classification of Diseases for Oncology, version 3. For more information see http://www.who.int/classifications/icd/adaptations/oncology/en/.","ValueSet/mii-vs-onko-icdo3-topographie,ConceptMap/cm-sct-to-icdo3-mamma-topographie,ValueSet/mii-vs-onko-icdo3-morphologie"
http://terminology.hl7.org/CodeSystem/medication-statement-category,4.0.1,draft,"2.16.840.1.113883.4.642.4.1120",Medication usage category codes,Medication usage category codes,"Medication Status Codes","ValueSet/medication-statement-category"
http://terminology.hl7.org/CodeSystem/medicationrequest-category,2.0.0,active,"2.16.840.1.113883.4.642.1.1323",MedicationRequestCategoryCodes,MedicationRequest Category Codes,"MedicationRequest Category Codes","ValueSet/medicationrequest-category"
http://terminology.hl7.org/CodeSystem/medicationrequest-course-of-therapy,1.0.1,active,"2.16.840.1.113883.4.642.1.1327",MedicationRequestCourseOfTherapyCodes,MedicationRequest Course of Therapy Codes,"MedicationRequest Course of Therapy Codes","ValueSet/medicationrequest-course-of-therapy"
http://terminology.hl7.org/CodeSystem/medicationrequest-status-reason,1.0.1,active,"2.16.840.1.113883.4.642.1.1325",MedicationRequestStatusReasonCodes,MedicationRequest Status Reason Codes,"MedicationRequest Status Reason Codes","ValueSet/medicationrequest-status-reason"
http://terminology.hl7.org/CodeSystem/observation-category,2.0.0,active,"2.16.840.1.113883.4.642.1.1125",ObservationCategoryCodes,Observation Category Codes,"Observation Category codes.","ValueSet/observation-category"
http://terminology.hl7.org/CodeSystem/referencerange-meaning,1.0.1,active,"2.16.840.1.113883.4.642.1.1124",ObservationReferenceRangeMeaningCodes,Observation Reference Range Meaning Codes,"This value set defines a set of codes that can be used to indicate the meaning/use of a reference range for a particular target population.","ValueSet/referencerange-meaning"
http://terminology.hl7.org/CodeSystem/risk-probability,1.0.1,active,"2.16.840.1.113883.4.642.1.1133",RiskProbability,Risk Probability,"Codes representing the likelihood of a particular outcome in a risk assessment.","ValueSet/vs-senologie-risikoklasse"
http://terminology.hl7.org/CodeSystem/v2-0074,3.0.0,active,"2.16.840.1.113883.18.29",DiagnosticServiceSectionId,diagnosticServiceSectionId,"HL7-defined code system of concepts which specify a section of a diagnostic service where the observation may be performed.  Used in HL7 Version 2.x messaging in the OBR and OM4 segments.","ValueSet/diagnostic-service-sections,ValueSet/mii-vs-patho-report-category-hl7"
http://terminology.hl7.org/CodeSystem/v2-0203,5.0.0,active,"2.16.840.1.113883.18.108",IdentifierType,identifierType,"HL7-defined code system of concepts specifying type of identifier. Used in HL7 Version 2.x messaging data types CX, PLN, PPN, XCN and XON.","ValueSet/identifier-type"
http://terminology.hl7.org/CodeSystem/v2-0371,3.0.0,active,"2.16.840.1.113883.18.229",AdditivePreservative,additivePreservative,"HL7-defined code system of concepts specifying any additive introduced to the specimen before or at the time of collection.  These additives may be introduced in order to preserve, maintain or enhance the particular nature or component of the specimen.  Used in HL7 Version 2.x messaging in the SPM and SAC segments.","ValueSet/v2-0371"
http://terminology.hl7.org/CodeSystem/v2-0373,3.0.0,active,"2.16.840.1.113883.18.231",Treatment,treatment,"Code system of concepts that identify the specimen treatment performed during lab processing.  Used in the Interaction Specimen Container Detail (SAC) segment in HL7 Version 2.x messaging.","ValueSet/specimen-processing-procedure"
http://terminology.hl7.org/CodeSystem/v2-0487,3.0.0,active,"2.16.840.1.113883.18.311",SpecimenType,specimenType,"HL7-defined code system of concepts that describe the precise nature of an entity that may be used as the source material for an observation.  This is one of two code systems that are used instead of table 0070 (code system 2.16.840.1.113883.18.28) which conflated specimen types and specimen collection methods.   Used in HL7 Version 2.x messaging in the SPM segment.","ValueSet/v2-0487"
http://terminology.hl7.org/CodeSystem/v2-0493,3.0.0,active,"2.16.840.1.113883.18.317",SpecimenCondition,specimenCondition,"Code system of concepts specifying a mode or state of being that describes the nature of the specimen.  Used in HL7 Version 2.x messaging in the SPM segment.","ValueSet/v2-0493"
http://terminology.hl7.org/CodeSystem/v2-0916,3.0.0,active,"2.16.840.1.113883.18.422",RelevantClincialInformation,relevantClincialInformation,"Code system of concepts specifying additional clinical information about the patient or specimen to report the supporting and/or suspected diagnosis and clinical findings on requests for interpreted diagnostic studies. Used in HL7 Version 2.x messaging in the OBR segment.","ValueSet/v2-0916"
http://terminology.hl7.org/CodeSystem/v3-ActReason,4.0.0,active,"2.16.840.1.113883.5.8",ActReason,ActReason,"A set of codes specifying the motivation, cause, or rationale of an Act, when such rationale is not reasonably represented as an ActRelationship of type ""has reason"" linking to another Act.    *Examples:* Example reasons that might qualify for being coded in this field might be: ""routine requirement"", ""infectious disease reporting requirement"", ""on patient request"", ""required by law"".","ValueSet/v3-SubstanceAdminSubstitutionReason"
http://terminology.hl7.org/CodeSystem/v3-GTSAbbreviation,4.0.0,active,"2.16.840.1.113883.5.1022",GTSAbbreviation,GTSAbbreviation,"*Open Issue:* It appears that the printnames are suboptimal and should be improved for many of the existing codes.","ValueSet/timing-abbreviation"
http://terminology.hl7.org/CodeSystem/v3-ObservationInterpretation,4.0.0,active,"2.16.840.1.113883.5.83",ObservationInterpretation,ObservationInterpretation,"One or more codes providing a rough qualitative interpretation of the observation, such as ""normal"" / ""abnormal"", ""low"" / ""high"", ""better"" / ""worse"", ""resistant"" / ""susceptible"", ""expected"" / ""not expected"". The value set is intended to be for ANY use where coded representation of an interpretation is needed.","ValueSet/observation-interpretation"
http://terminology.hl7.org/CodeSystem/v3-RoleCode,4.0.0,active,"2.16.840.1.113883.5.111",RoleCode,RoleCode,"A set of codes further specifying the kind of Role; specific classification codes for further qualifying RoleClass codes.","ValueSet/v3-FamilyMember,ValueSet/v3-ServiceDeliveryLocationRoleType"
http://terminology.hl7.org/CodeSystem/v3-TimingEvent,4.0.0,active,"2.16.840.1.113883.5.139",TimingEvent,TimingEvent,"**** MISSING DESCRIPTION ****","ValueSet/event-timing"
http://terminology.hl7.org/CodeSystem/v3-substanceAdminSubstitution,4.0.0,active,"2.16.840.1.113883.5.1070",SubstanceAdminSubstitution,Substance Admin Substitution,"Identifies what sort of change is permitted or has occurred between the therapy that was ordered and the therapy that was/will be provided.","ValueSet/v3-ActSubstanceAdminSubstitutionCode"
http://terminology.hl7.org/CodeSystem/variant-confidence-status-cs,3.0.0,active,,VariantConfidenceStatusCS,Variant Confidence Status Codes,"A code that represents the confidence of a true positive variant call.","ValueSet/variant-confidence-status-vs"
http://unitsofmeasure.org,3.0.1,active,,UCUM,Unified Code for Units of Measure (UCUM),"The Unified Code for Units of Measure (UCUM) is a code system intended to include all units of measures being contemporarily used in international science, engineering, and business. The purpose is to facilitate unambiguous electronic communication of quantities together with their units. The focus is on electronic communication, as opposed to communication between humans. A typical application of The Unified Code for Units of Measure are electronic data interchange (EDI) protocols, but there is nothing that prevents it from being used in other types of machine communication.","ValueSet/DosageDoseQuantityDE,ValueSet/units-of-time,ValueSet/mii-vs-onko-strahlentherapie-strahlungseinheit"
http://varnomen.hgvs.org,2.0.1,active,"2.16.840.1.113883.6.282",Hgvs,Human Genome Variation Society nomenclature,"HGVS nomenclatures are the guidelines for mutation nomenclature made by the Human Genome Variation Society.    HGVS nomenclature can be used with the HL7 coded data type (code data type that accepts expression data, or a coded expression data type). This coded data type should be able to distinguish expressions in HGVS nomenclature from coded concepts. For example, in the HL7 messages specified according to the HL7 V2 Clinical Genomics Fully LOINC-Qualified Genetic Variation Model, HGVS nomenclature can be used to as the observation values for DNA sequence variations. For example, OBX|1|CWE|48004-6^DNA Sequence Variation^LN||c.1129C>T^^HGVS|    Versioning information: The HGVS nomenclature for the description of sequence variants was last modified Feb 20, 2008. The HGVS nomenclature for the description of protein sequence variants was last modified May 12, 2007. The HGVS nomenclature for the description of DNA sequence variants was last modified June 15, 2007 The HGVS nomenclature for the description of RNA sequence variants was last modified May 12, 2007    HGVS nomenclatures can be used freely by the public.","ValueSet/hgvs-vs"
